{
  "$schema": "./schema/protocol-foundation-compatibility.schema.json",
  "formatVersion": 1,
  "phase": "phase-2a-protocol-foundation",
  "implementationCommit": "pending-main-merge",
  "dartSdkConstraint": "^3.6.0",
  "sources": [
    {
      "sourceId": "acp-v1",
      "release": "schema-v1.20.0",
      "revision": "5e89c71497fe07dd4ae633c181a17224f4a8956d",
      "wireVersion": "1",
      "artifactRefs": [
        "acp-schema-v1",
        "acp-meta-v1",
        "acp-license"
      ]
    },
    {
      "sourceId": "mcp-2025-11-25",
      "release": "2025-11-25",
      "revision": "38c84e9f93ad191d9eb26d92b945d17bd0efcaf3",
      "wireVersion": "2025-11-25",
      "artifactRefs": [
        "mcp-schema-2025-11-25",
        "mcp-license"
      ]
    },
    {
      "sourceId": "mcp-conformance-v0.1.16",
      "release": "v0.1.16",
      "revision": "21a9a2febd7100d7c17ac1021ee7f2ed9f66a1e0",
      "wireVersion": "2025-11-25",
      "artifactRefs": [
        "mcp-conformance-package",
        "mcp-conformance-scenarios",
        "mcp-conformance-license"
      ]
    }
  ],
  "claims": [
    {
      "id": "P2A-UTIL-01",
      "protocol": "protocol-utils",
      "level": "implemented",
      "summary": "Strict JSON-safe values and JSON-RPC 2.0 envelopes.",
      "sourceRefs": [
        "acp-v1",
        "mcp-2025-11-25"
      ],
      "evidenceRefs": [
        "EV-P2A-UTIL-01"
      ],
      "knownUnsupportedRefs": [
        "KU-JSONRPC-BATCH"
      ]
    },
    {
      "id": "P2A-UTIL-02",
      "protocol": "protocol-utils",
      "level": "implemented",
      "summary": "Bounded NDJSON, Content-Length, and SSE framing.",
      "sourceRefs": [
        "acp-v1",
        "mcp-2025-11-25"
      ],
      "evidenceRefs": [
        "EV-P2A-UTIL-02"
      ],
      "knownUnsupportedRefs": []
    },
    {
      "id": "P2A-UTIL-03",
      "protocol": "protocol-utils",
      "level": "implemented",
      "summary": "Correlation, dispatch, cancellation, races, and backpressure.",
      "sourceRefs": [
        "acp-v1",
        "mcp-2025-11-25"
      ],
      "evidenceRefs": [
        "EV-P2A-UTIL-03"
      ],
      "knownUnsupportedRefs": []
    },
    {
      "id": "P2A-ACP-01",
      "protocol": "acp",
      "level": "implemented",
      "summary": "Pinned source lock, 142 definitions, 23 methods, and roots.",
      "sourceRefs": [
        "acp-v1"
      ],
      "evidenceRefs": [
        "EV-P2A-ACP-01"
      ],
      "knownUnsupportedRefs": [
        "KU-ACP-DRAFTS"
      ]
    },
    {
      "id": "P2A-ACP-02",
      "protocol": "acp",
      "level": "implemented",
      "summary": "Generated stable models, role codec, golden, and rejection gates.",
      "sourceRefs": [
        "acp-v1"
      ],
      "evidenceRefs": [
        "EV-P2A-ACP-02"
      ],
      "knownUnsupportedRefs": []
    },
    {
      "id": "P2A-ACP-03",
      "protocol": "acp",
      "level": "implemented",
      "summary": "Initialize, version, capability, and lifecycle negotiation.",
      "sourceRefs": [
        "acp-v1"
      ],
      "evidenceRefs": [
        "EV-P2A-ACP-03"
      ],
      "knownUnsupportedRefs": []
    },
    {
      "id": "P2A-ACP-04",
      "protocol": "acp",
      "level": "implemented",
      "summary": "Session creation, modes, configuration, listing, deletion, close, and logout.",
      "sourceRefs": [
        "acp-v1"
      ],
      "evidenceRefs": [
        "EV-P2A-ACP-04"
      ],
      "knownUnsupportedRefs": []
    },
    {
      "id": "P2A-ACP-05",
      "protocol": "acp",
      "level": "implemented",
      "summary": "Prompt content, updates, tools, plans, usage, and terminal ordering.",
      "sourceRefs": [
        "acp-v1"
      ],
      "evidenceRefs": [
        "EV-P2A-ACP-05"
      ],
      "knownUnsupportedRefs": []
    },
    {
      "id": "P2A-ACP-06",
      "protocol": "acp",
      "level": "implemented",
      "summary": "Client reverse filesystem, terminal, and permission requests.",
      "sourceRefs": [
        "acp-v1"
      ],
      "evidenceRefs": [
        "EV-P2A-ACP-06"
      ],
      "knownUnsupportedRefs": [
        "KU-CALLER-OWNERSHIP"
      ]
    },
    {
      "id": "P2A-ACP-07",
      "protocol": "acp",
      "level": "implemented",
      "summary": "Session and request cancellation, late updates, and terminal barriers.",
      "sourceRefs": [
        "acp-v1"
      ],
      "evidenceRefs": [
        "EV-P2A-ACP-07"
      ],
      "knownUnsupportedRefs": []
    },
    {
      "id": "P2A-ACP-08",
      "protocol": "acp",
      "level": "implemented",
      "summary": "Historical load replay and resume without false active-attach claims.",
      "sourceRefs": [
        "acp-v1"
      ],
      "evidenceRefs": [
        "EV-P2A-ACP-08"
      ],
      "knownUnsupportedRefs": [
        "KU-ACP-ACTIVE-ATTACH"
      ]
    },
    {
      "id": "P2A-ACP-09",
      "protocol": "acp",
      "level": "verified",
      "summary": "Scripted peer chaos and bounded observational record/replay.",
      "sourceRefs": [
        "acp-v1"
      ],
      "evidenceRefs": [
        "EV-P2A-ACP-09"
      ],
      "knownUnsupportedRefs": []
    },
    {
      "id": "P2A-ACP-10",
      "protocol": "acp",
      "level": "verified",
      "summary": "Fixed real-process Dart, TypeScript, and Rust peer tuples.",
      "sourceRefs": [
        "acp-v1"
      ],
      "evidenceRefs": [
        "EV-P2A-ACP-10"
      ],
      "knownUnsupportedRefs": [
        "KU-ACP-CONFORMANCE"
      ]
    },
    {
      "id": "P2A-MCP-01",
      "protocol": "mcp",
      "level": "implemented",
      "summary": "Pinned source lock, 145 definitions, and complete role/method inventory.",
      "sourceRefs": [
        "mcp-2025-11-25"
      ],
      "evidenceRefs": [
        "EV-P2A-MCP-01"
      ],
      "knownUnsupportedRefs": []
    },
    {
      "id": "P2A-MCP-02",
      "protocol": "mcp",
      "level": "implemented",
      "summary": "Generated models, role codec, schema, golden, and unknown-value gates.",
      "sourceRefs": [
        "mcp-2025-11-25"
      ],
      "evidenceRefs": [
        "EV-P2A-MCP-02"
      ],
      "knownUnsupportedRefs": []
    },
    {
      "id": "P2A-MCP-03",
      "protocol": "mcp",
      "level": "implemented",
      "summary": "Initialize, fixed version, capability, lifecycle, and reconnect behavior.",
      "sourceRefs": [
        "mcp-2025-11-25"
      ],
      "evidenceRefs": [
        "EV-P2A-MCP-03"
      ],
      "knownUnsupportedRefs": []
    },
    {
      "id": "P2A-MCP-04",
      "protocol": "mcp",
      "level": "implemented",
      "summary": "Tools, resources, prompts, completion, logging, and pagination.",
      "sourceRefs": [
        "mcp-2025-11-25"
      ],
      "evidenceRefs": [
        "EV-P2A-MCP-04"
      ],
      "knownUnsupportedRefs": []
    },
    {
      "id": "P2A-MCP-05",
      "protocol": "mcp",
      "level": "implemented",
      "summary": "Reverse sampling, roots, and elicitation requests.",
      "sourceRefs": [
        "mcp-2025-11-25"
      ],
      "evidenceRefs": [
        "EV-P2A-MCP-05"
      ],
      "knownUnsupportedRefs": []
    },
    {
      "id": "P2A-MCP-06",
      "protocol": "mcp",
      "level": "implemented",
      "summary": "Progress, cancellation, tasks, late responses, and terminal races.",
      "sourceRefs": [
        "mcp-2025-11-25"
      ],
      "evidenceRefs": [
        "EV-P2A-MCP-06"
      ],
      "knownUnsupportedRefs": []
    },
    {
      "id": "P2A-MCP-07",
      "protocol": "mcp",
      "level": "implemented",
      "summary": "Stdio framing, scripted peer, stderr, and process-exit handling.",
      "sourceRefs": [
        "mcp-2025-11-25"
      ],
      "evidenceRefs": [
        "EV-P2A-MCP-07"
      ],
      "knownUnsupportedRefs": [
        "KU-CALLER-OWNERSHIP"
      ]
    },
    {
      "id": "P2A-MCP-08",
      "protocol": "mcp",
      "level": "implemented",
      "summary": "Streamable HTTP POST, GET, DELETE, sessions, SSE, and resumption.",
      "sourceRefs": [
        "mcp-2025-11-25"
      ],
      "evidenceRefs": [
        "EV-P2A-MCP-08"
      ],
      "knownUnsupportedRefs": [
        "KU-CALLER-OWNERSHIP"
      ]
    },
    {
      "id": "P2A-MCP-09",
      "protocol": "mcp",
      "level": "implemented",
      "summary": "OAuth metadata, PKCE, registration, scopes, token binding, and retries.",
      "sourceRefs": [
        "mcp-2025-11-25"
      ],
      "evidenceRefs": [
        "EV-P2A-MCP-09"
      ],
      "knownUnsupportedRefs": [
        "KU-CALLER-OWNERSHIP"
      ]
    },
    {
      "id": "P2A-MCP-10",
      "protocol": "mcp",
      "level": "implemented",
      "summary": "MCP tool to neutral AI mapping with schema, error, task, and collision coverage.",
      "sourceRefs": [
        "mcp-2025-11-25"
      ],
      "evidenceRefs": [
        "EV-P2A-MCP-10"
      ],
      "knownUnsupportedRefs": [
        "KU-MCP-MAPPING-UNKNOWN"
      ]
    },
    {
      "id": "P2A-MCP-11",
      "protocol": "mcp",
      "level": "implemented",
      "summary": "Resource and prompt mapping with strict and preserve policies.",
      "sourceRefs": [
        "mcp-2025-11-25"
      ],
      "evidenceRefs": [
        "EV-P2A-MCP-11"
      ],
      "knownUnsupportedRefs": [
        "KU-MCP-MAPPING-UNKNOWN"
      ]
    },
    {
      "id": "P2A-MCP-12",
      "protocol": "mcp",
      "level": "implemented",
      "summary": "Bounded redacted record/replay with framing recomputation.",
      "sourceRefs": [
        "mcp-2025-11-25"
      ],
      "evidenceRefs": [
        "EV-P2A-MCP-12"
      ],
      "knownUnsupportedRefs": []
    },
    {
      "id": "P2A-MCP-13",
      "protocol": "mcp",
      "level": "verified",
      "summary": "Fixed real-process MCP stdio client/server tuple.",
      "sourceRefs": [
        "mcp-2025-11-25"
      ],
      "evidenceRefs": [
        "EV-P2A-MCP-13"
      ],
      "knownUnsupportedRefs": [
        "KU-MCP-STDIO-CONFORMANCE"
      ]
    },
    {
      "id": "P2A-MCP-14",